{
  "registry_version": "fleet-rollout-registry/v1",
  "catalog_version": "fleet-error-catalog/v2",
  "updated_at": "2026-10-21",
  "note": "Which fleet capability each strategy actually has. A capability or catalog behaviour that a strategy does not have yet must be listed here as pending (with the phase it lands in and why) or n/a (with why) -- CI fails otherwise. Seeded 2026-09-18 from a read of all four repos. 'done' means present on the branch the live host deploys from (sources: operations), not merely merged to development or running on the dev host; file:line evidence refers to the commit recorded in sources. The human page docs/guides/fleet-rollout-register.html is generated from this file. A pending cell that waits for a deployment names the commit it waits for (awaits_commit); the observation watch flags it once A1 runs that commit (docs/observation-watch.md). A done cell's evidence is what the code does with its file:line citations (max 700 characters); verified_at is the date of the last check against A1, limit is one sentence on what the claim does not show; the long A1 verification text lives in docs/registry-a1-checks.json.",
  "projects": {
    "momentum": "動能策略",
    "seykota": "趨勢策略",
    "mycrypto": "加密策略",
    "btc-competition": "競賽策略"
  },
  "phases": {
    "v2-W2": "分級 v2：共用修復執行器（trade-alerts）",
    "v2-W3": "分級 v2：動能策略改用共用修復執行器、拿掉過渡開關",
    "v2-W4": "分級 v2：趨勢策略的修復機器人升到完整版",
    "v2-W6": "分級 v2：部署到開發機與正式機",
    "8-momentum": "第 8 關：動能策略的錯誤條目全部接上事件日誌與白話通知",
    "8-seykota": "第 8 關：趨勢策略的錯誤條目接上事件日誌、白話通知與 v2 自動重試；修掉「改設定重啟也清不掉暫停」",
    "8-mycrypto": "第 8 關：加密策略的錯誤條目接上事件日誌、白話通知與 v2 自動重試（大部分隨加密換 Binance 由 x3 完成；剩停放的平倉寫進事件日誌）",
    "8-btc-competition": "第 8 關：競賽策略的錯誤條目接上事件日誌、白話通知與 v2 自動重試",
    "binance-funding-sync": "尚未排定：需要先幫共用的 binance-trading-toolkit 加上資金費查詢能力，兩支策略才能各自接上",
    "naming-rollout": "用詞統一：各 repo 的文件與訊息改用中英對照表的統一名詞",
    "7e": "第 7 關 e：Telegram 警報流程（ops-control 持續提醒＋「開始處理」「處理完成」按鈕）——2026-10-12 使用者決定取消：停用 Telegram 遙控，持續提醒改由維運通知發送（f-39），不做按鈕",
    "hotfix-seykota-order-resend": "緊急修正：趨勢策略市價單送出後查不到就重送，2026-09-21 真倉因此重複開倉（ed-seykota PR #65）",
    "unrecorded-fill": "g1：帳本少記交易所成交——共用處理程式 trade_alerts.unrecorded_fill 偵測並判斷；只有確定是策略自己重複送單（自訂編號相同）才自動更正並立刻通知（R3），其他一律不寫帳本、開請求並通知（R3）。四支一起：趨勢、動能接修復機器人；競賽、加密新增計時器與通知管道（加密不帶自訂編號，只通知）。",
    "repair-recurrence": "g2：自動修補重複發生時通知——共用庫的修復執行器已實作並已上 A1（趨勢、動能、加密各自接上）；競賽沒有修復機器人，列不適用",
    "error-ids": "錯誤編號：錯誤目錄每條配固定編號（ERR-001…），所有通知第一行＝【編號】＋目錄標題；對帳狀態告警也補進目錄。併入通知分兩則（v3）同一次改",
    "hotfix-btc-order-resend": "緊急修正：競賽策略送單結果不明時，同一輪以新 client id 重新規劃再送（2026-09-24 h7 查核重現；btc-bull-market-competition PR #35）",
    "h4-trade-correction": "帳本更正事件：共用格式與套用規則（trade-alerts）＋趨勢策略接上並更正 2026-09-21 重複進場與 09-19 估算值兩筆（h4）；修復機器人自動產生更正屬 unrecorded-fill（g1）",
    "hotfix-seykota-stop-resolution": "緊急修正：趨勢策略停損單被交易所拒絕、或取消停損一直失敗時，程式無限重試卡住（2026-09-24 h5／h11 以 Binance 測試網查證；ed-seykota PR #72、#74）",
    "f-12": "A1 優雅停止與重啟後復原（f-12）：收到停止訊號時等當輪做完、被硬殺後重啟能接回原本的交易、孤兒部位要通知",
    "f-16": "f-16：Google 表同步佇列不被找不到開倉列的平倉卡死（共用庫停放找不到開倉列的平倉＋對帳忽略清單，v0.25.1／v0.26.0）",
    "x3-crypto-binance": "加密策略換到 Binance（x 系列）：2026-10-17 台北 17:30 起 A1 加密是 Binance 主網真倉（第一筆空 0.001 BTC 持倉中，觀察一週）；x4 等價驗證、x5 開發機測試網實測已結案。2026-10-19 台北 19:25 起 A1 跑 operations a60e94f（共用庫 v0.30.9）：接手成交配對守門測試（#100）、自家單號 mc- 與少記成交自動更正（g1-6，#102）、停損觸發價被越過（-2021）改市價平倉（f-54，#104）都已上 A1，但 A1 沒有遇過這些情境，只有測試與開發機測試網實測；A1 還沒走過的：人工更正工具對真實 Binance 的端到端、真實平倉與停損觸發走過 Google 新版投影、開發機 x5b 乾淨的接手→對帳端到端（通知經 A1 送到手機已於 2026-10-18 驗過）；Google 新版投影（x3e-1～x3e-5）與人工更正工具（x3e-6）已於 2026-10-16 上 A1，共用庫已隨 x3b 升到 v0.30.7",
    "t9-competition-retry": "t9：競賽策略失敗時當天重試（同一程序內每 15 分鐘一次、共 3 次）並在失敗時通知——共用庫 v0.27.6 錯誤清單已改；競賽程式在 PR #45（審閱中，合併後上開發機實測），之後才部署 A1 正式機（新）",
    "f-26a": "f-26a：資金費同步寫不進 Google 表的「帳戶餘額總表」分頁時要看得見（錯誤清單 ERR-057／058／059、結束碼 3、事件日誌通知）並把預設專案名改成策略中文名（趨勢、動能、加密各一個 PR；共用庫 v0.29.0；部署 A1 正式機（新）後改已做；加密還要加進維運通知監控清單）",
    "f-28b": "f-28b：動能的「未結清標記」對帳沒有時間上限（共用庫加上限、動能改釘、上 A1 正式機（新）後改已做；競賽那一半 f-28 已在 A1）"
  },
  "sources": {
    "momentum": {
      "repo": "AI-for-column5/mexc-4h-momentum-trailing-stop",
      "branch": "operations",
      "commit": "3031e9c04d8b1c8e629440377deef864cf8ca8d5"
    },
    "seykota": {
      "repo": "AI-for-column5/ed-seykota-systematic-trend-following",
      "branch": "operations",
      "commit": "560aec073667283c3022b7341a0aaad1d70322b1"
    },
    "mycrypto": {
      "repo": "AI-for-column5/my-crypto-bot",
      "branch": "operations",
      "commit": "a60e94f6649f4c5dd2cb17ad503af0e7b2f863ce"
    },
    "btc-competition": {
      "repo": "AI-for-column5/btc-bull-market-competition",
      "branch": "operations",
      "commit": "a8a1ba1ac8871be6866bf6659c73af26905fef8c"
    }
  },
  "capabilities": [
    {
      "id": "latch.unified_model",
      "title": "統一格式的安全暫停",
      "description": "出事時用同一套欄位（原因碼＋證據＋確認碼）讓策略安全暫停，四支才能用同一套解除與通知流程。",
      "status": {
        "momentum": {
          "state": "done",
          "evidence": "src/strategy.py:1365 build_safe_halt（Phase 4c）"
        },
        "seykota": {
          "state": "done",
          "evidence": "src/seykota_bot/bot.py:483 build_safe_halt（Phase 4c）"
        },
        "mycrypto": {
          "state": "n/a",
          "reason": "使用者 2026-09-12 定案加密策略不加安全暫停：出錯照常繼續、下一輪重試。"
        },
        "btc-competition": {
          "state": "done",
          "evidence": "src/btc_competition/runner.py:482 build_safe_halt（Phase 4c）"
        }
      }
    },
    {
      "id": "latch.resume_tool",
      "title": "兩段式解除工具",
      "description": "先預覽拿確認碼、再帶確認碼解除，避免清掉的不是眼前這一次的暫停。",
      "status": {
        "momentum": {
          "state": "done",
          "evidence": "src/safe_halt_resume.py（--apply --confirm --exchange-verified）"
        },
        "seykota": {
          "state": "done",
          "evidence": "seykota-resume（src/seykota_bot/safe_halt_resume.py）"
        },
        "mycrypto": {
          "state": "n/a",
          "reason": "使用者 2026-09-12 定案加密策略不加安全暫停：出錯照常繼續、下一輪重試。"
        },
        "btc-competition": {
          "state": "done",
          "evidence": "btc-competition-resume（src/btc_competition/safe_halt_resume.py）"
        }
      }
    },
    {
      "id": "latch.restart_only_clear",
      "title": "「改好設定重啟」就能解除的安全暫停真的會被清掉",
      "description": "設定錯誤類的暫停（例如連錯交易所）不能用解除工具清，只能改好設定後重啟；重啟後系統要自己確認設定正確並解除。",
      "status": {
        "momentum": {
          "state": "n/a",
          "reason": "沒有「改設定重啟」這一類暫停。"
        },
        "seykota": {
          "state": "done",
          "evidence": "src/seykota_bot/bot.py:559 _clear_config_halt_if_fixed 只處理 EXCHANGE_TARGET_UNSAFE 與 FIXED_IDENTIFIER_CONTRACT_UNAVAILABLE 兩種：重啟後把原本擋下的守門檢查再跑一次，通過就追加 safe_halt_cleared（method=config_fixed_restart）、清掉暫停並記 safe_halt_cleared_after_config_fix（:599）；src/seykota_bot/bot.py:2246 策略在線時每輪先呼叫它；解除工具 src/seykota_bot/safe_halt_resume.py:134 仍刻意拒絕這兩類（只准改好設定重啟）。PR #79（f-12）。",
          "verified_at": "2026-10-15",
          "limit": "A1 沒有發生過這兩類設定錯誤暫停，沒有實際觸發過；錯誤清單 ERR-009／ERR-010 的處理步驟與追查指令已改成現況（共用庫 v0.30.8，2026-10-15 台北隨 A1 部署，A1 讀得到的錯誤清單已沒有「已知缺陷」文字）；新文字沒有在真實暫停時被收到過。"
        },
        "mycrypto": {
          "state": "n/a",
          "reason": "使用者 2026-09-12 定案加密策略不加安全暫停：出錯照常繼續、下一輪重試。"
        },
        "btc-competition": {
          "state": "n/a",
          "reason": "沒有「改設定重啟」這一類暫停。"
        }
      }
    },
    {
      "id": "latch.consecutive_failure_counter",
      "title": "連續失敗 3 次才升格（不因一次意外就停）",
      "description": "暫時性的錯誤先自動重試，連續失敗才停下或通知人。",
      "status": {
        "momentum": {
          "state": "n/a",
          "reason": "未分類例外不暫停：寫錯誤心跳、下一輪重試（R0）。"
        },
        "seykota": {
          "state": "done",
          "evidence": "src/seykota_bot/bot.py:54 _CONSECUTIVE_FAILURE_LATCH_THRESHOLD Phase 4d 連續失敗計數器（RECONCILE_FAILED／RUNTIME_CYCLE_FAILED）；計數只算非暫時性的失敗：對帳讀取與 K 線抓取遇到暫時性網路錯誤（HTTP 5xx／408、後端碼 -1000／-1001／-1006／-1007）不計入、下一輪直接重試（src/seykota_bot/bot.py:1599、src/seykota_bot/bot.py:2282，#89）"
        },
        "mycrypto": {
          "state": "done",
          "evidence": "failure_episodes.py:135 FailureEpisodes.failure：同一段失敗連續 3 次（failure_episodes.py:54 THRESHOLD）才升格並只寫一則事件，成功就結束這一段，狀態存在 state/failure-episodes.json、重啟接續、事件編號由失敗期間推導（重啟後不重複通知）；mexc_futures_bot.py:2319 run_forever 整輪例外連續 3 輪才通知（ERR-027）；mexc_futures_bot.py:1231 沒有交易所端停損連續 3 輪（ERR-029／031）；mexc_futures_bot.py:1241 殘留停損單取消連續 3 次（ERR-032）。my-crypto-bot #73（審閱 3 輪）。2026-10-14 台北 12:05 隨 A1 正式機（新）部署（operations 0757c6f；A1 /opt 內根目錄 .py 與 deploy 檔逐檔雜湊與該 commit 相同，部署前後單元清單只多了新的匯出計時器與服務、0 個失敗單元）。",
          "limit": "A1 加密 2026-10-17 台北 17:30 起是 Binance 主網真倉運作（第一筆持倉中），這條路徑到目前還沒被實際觸發過，只有測試（CI 與開發機測試網）驗證。"
        },
        "btc-competition": {
          "state": "n/a",
          "reason": "未分類例外不暫停：寫錯誤心跳、隔天重試（R0）。"
        }
      }
    },
    {
      "id": "runtime.status_snapshot",
      "title": "策略運行狀態（維運通知的第四軸）",
      "description": "每支策略定時寫出自己「正常／暫停／出錯」的狀態，維運通知據此提醒。",
      "status": {
        "momentum": {
          "state": "done",
          "evidence": "src/portfolio_snapshot_adapter.py strategy.runtime_status"
        },
        "seykota": {
          "state": "done",
          "evidence": "src/seykota_bot/portfolio_snapshot_adapter.py strategy.runtime_status"
        },
        "mycrypto": {
          "state": "done",
          "evidence": "portfolio_snapshot_adapter.py:77 _runtime_status（strategy.runtime_status）"
        },
        "btc-competition": {
          "state": "done",
          "evidence": "src/btc_competition/portfolio_snapshot_adapter.py strategy.runtime_status"
        }
      }
    },
    {
      "id": "reconcile.ledger_status",
      "title": "帳本↔交易所對帳狀態檔",
      "description": "定時比對本地帳本與交易所，寫出 audit/ledger_status.json 給維運通知讀。",
      "status": {
        "momentum": {
          "state": "done",
          "evidence": "src/reconcile_compare.py"
        },
        "seykota": {
          "state": "done",
          "evidence": "src/seykota_bot/reconcile/compare.py"
        },
        "mycrypto": {
          "state": "done",
          "evidence": "reconcile_compare.py:102 main"
        },